Fuente,Titulo,URL,Titulo_Limpio,Contenido,Sentimiento_recalculado,Polaridad_recalculada,Menciones_Noboa,Menciones_Gonzalez,Temas
Expreso,"Cartas de lectores: Resultados de segunda vuelta electoral, discursos e imaginarios",https://www.expreso.ec/opinion/carta-de-lectores/cartas-lectores-resultados-segunda-vuelta-electoral-discursos-e-imaginarios-239620.html,"Cartas de lectores: Resultados de segunda vuelta electoral, discursos e imaginarios","Síguenos Noboa debe entender que su triunfo no es un cheque en blanco. Ganó por el rechazo al correísmo Como nunca antes, el análisis político exige considerar la capacidad humana para crear y difundir mundos imaginarios; un sujeto vendedor de imágenes en un mercado de lo imaginario, donde es fácil engañarse y engañar. La avalancha de percepciones generadas por la información masiva, sobre todo en redes sociales, llevó a creer que Luisa González ganaría o que Daniel Noboa vencería por poco. Esta vez no hubo fraude en ninguna vuelta. Muchos se defraudaron por su imaginación, atrapados entre imágenes y humo. Pero la realidad, con su dinámica propia, se impone más allá de la fantasía política, la demagogia y la posverdad. La verdad se separa del artificio, aunque también depende de la disposición a guiarse por la objetividad. De los dieciséis candidatos iniciales, la votación se polarizó entre Noboa y González, quienes promovieron esa división: él como anticorreísmo, ella como antinoboísmo. Muchos votaron más ‘en contra’ que ‘a favor’. Noboa ganó con una diferencia de 11 %, con un respaldo clave del voto de rechazo al correísmo. Ese correísmo ya no es el de Alianza PAIS, que proponía una revolución ética y social. Con el tiempo, ese proyecto derivó en autoritarismo y corrupción. La Revolución Ciudadana perdió su esencia y cayó en la decadencia del progresismo regional. González no logró proyectar independencia de Correa, a quien presentó como su principal asesor, reforzando la percepción de dependencia. Además, otros actores del movimiento, como Jorge Glas, sumaron al desgaste. Muchos vieron a la Revolución Ciudadana incapaz de garantizar seguridad jurídica ni combatir el crimen organizado, clave para la recuperación económica . También generaron temor propuestas como los “ ecuadólares ” y el uso de reservas internacionales, afectando la confianza en la dolarización. Estos errores explican su derrota. El rol del movimiento indígena requiere otro análisis. Es hora de que los actores políticos reflexionen con autocrítica. Noboa debe entender que su triunfo no es un cheque en blanco. Ganó por el rechazo al correísmo. Está obligado a revisar políticas económicas, sociales, ambientales y de seguridad, y a eliminar la arbitrariedad jurídica. No hay espacio para la soberbia: se debe gobernar con honradez y respeto a la Constitución. Carlos Castro Riera Las Últimas Noticias LO MÁS VISTO Ciencia y Tecnología Gira alrededor de su estrella y desprende una gran cantidad de minerales Guayaquil Un accidente en una construcción de Puerto Santa Ana dejó al menos tres trabajadores heridos este sábado 26 de abril Guayaquil El debate sobre cómo revivir el sentido comunitario en zonas porteñas toma fuerza. Expertos analizan la situación Mundo Taif produce cada año 300 millones de estas emblemáticas flores Mundo Tras la muerte del papa Francisco, el Vaticano sigue funcionando como un reloj Actualidad Tres elecciones presidenciales perdidas. Para expertos, el exmandatario debería dar un paso al costado, pero a qué costo Deportes Filtraciones apuntan a intereses económicos detrás de la titularidad del jugador juvenil que no destaca en su club Ocio El escritor español publicó ‘Canon de cámara oscura', obra que explora la escritura en medio del auge tecnológico Síguenos TODOS LOS DERECHOS RESERVADOS ©2025. QUEDA EXPRESAMENTE PROHIBIDO, TANTO DIRECTA COMO INDIRECTAMENTE, CEDER O TRANSMITIR A TERCEROS TODA O PARTE DE LA INFORMACIÓN AQUÍ PRESENTADA, SIN LA CORRESPONDIENTE LICENCIA O AUTORIZACIÓN POR PARTE DE GRÁFICOS NACIONALES S.A.",neutro,0.03333333333333333,6,1,"Seguridad, Corrupción"
Expreso,CNE emite resultados preliminares de la segunda vuelta en la audiencia de escrutinio,https://www.expreso.ec/actualidad/cne-emite-resultados-preliminares-segunda-vuelta-audiencia-escrutinio-239598.html,CNE emite resultados preliminares de la segunda vuelta en la audiencia de escrutinio,"Síguenos Atamaint dijo que falta un acta de París, de la circunscripción de Europa para cerrar la sesión La presidenta del Consejo Nacional Electoral ( CNE ), Diana Atamaint, instaló este 19 de abril de 2025, junto al pleno del organismo, la audiencia pública nacional de escrutinio de la segunda vuelta de las elecciones presidenciales. (Te invitamos a leer: Más de 900 votantes fotografiaron la papeleta en las elecciones; ¿en qué provincias? ) Elecciones Ecuador: CNE espera paquetes del exterior para cerrar escrutinio de votos En la sesión, el secretario general de la Función Electoral, Santiago Vallejo, expuso las cifras de los resultados preliminares de las actas elaboradas por las 24 juntas provinciales, casi una semana después de que se celebraran las votaciones el pasado domingo 13 de abril. Los delegados de los movimientos políticos de los candidatos, Acción Democrática Nacional ( ADN ) y Revolución Ciudadana ( RC ), asistieron a la sesión electoral. Los reportes preliminares señalan que, en total, el binomio de ADN, conformado por Daniel Noboa y María José Pinto, obtuvo 5,870,502 votos (55.63%), mientras que el de la fórmula rival correísta, Luisa González y Diego Borja, alcanzó 4,683,147 sufragios (44.37%). Entre ambos hay una diferencia de (1,187,355) votos. Luisa González: ¿Cuáles son sus evidencias para denunciar supuesto robo de votos? También se conoció que en la segunda vuelta sufragaron 11,394,004 personas, los votos nulos alcanzaron el 6.7% y los blancos llegaron al 0.67%. Atamaint dijo que faltaba un acta electoral de París, perteneciente a la circunscripción de Europa, Asia y Oceanía. “Esperamos que llegue para poder conocer en el Pleno y cerrar la sesión,” dijo antes de suspender la reunión del Consejo. ¿Quieres acceder a todo el contenido de calidad sin límites? ¡SUSCRÍBETE AQUÍ! Las Últimas Noticias LO MÁS VISTO Ciencia y Tecnología Gira alrededor de su estrella y desprende una gran cantidad de minerales Guayaquil Un accidente en una construcción de Puerto Santa Ana dejó al menos tres trabajadores heridos este sábado 26 de abril Guayaquil El debate sobre cómo revivir el sentido comunitario en zonas porteñas toma fuerza. Expertos analizan la situación Mundo Taif produce cada año 300 millones de estas emblemáticas flores Mundo Tras la muerte del papa Francisco, el Vaticano sigue funcionando como un reloj Actualidad Tres elecciones presidenciales perdidas. Para expertos, el exmandatario debería dar un paso al costado, pero a qué costo Deportes Filtraciones apuntan a intereses económicos detrás de la titularidad del jugador juvenil que no destaca en su club Ocio El escritor español publicó ‘Canon de cámara oscura', obra que explora la escritura en medio del auge tecnológico Síguenos TODOS LOS DERECHOS RESERVADOS ©2025. QUEDA EXPRESAMENTE PROHIBIDO, TANTO DIRECTA COMO INDIRECTAMENTE, CEDER O TRANSMITIR A TERCEROS TODA O PARTE DE LA INFORMACIÓN AQUÍ PRESENTADA, SIN LA CORRESPONDIENTE LICENCIA O AUTORIZACIÓN POR PARTE DE GRÁFICOS NACIONALES S.A.",neutro,0.02500000000000001,2,0,Otros
Expreso,Luisa González rompe el silencio sobre el presunto fraude: ¿qué pruebas dice tener?,https://www.expreso.ec/actualidad/luisa-gonzalez-rompe-silencio-presunto-fraude-pruebas-dice-239319.html,Luisa González rompe el silencio sobre el presunto fraude: ¿qué pruebas dice tener?,"Síguenos La candidata presidencial del correísmo argumentó su denuncia de fraude tres días después de la segunda vuelta electoral Tres días después de la segunda vuelta del 13 de abril de 2025, la candidata presidencial de la Revolución Ciudadana, Luisa González , rompió el silencio sobre el presunto fraude que, según denunció, ocurrió en el balotaje contra el presidente Daniel Noboa . A través de un video colgado en sus redes sociales la noche del 16 de abril de 2025, González salió a agradecer a sus votantes, pero también a detallar las irregularidades del proceso electoral que, a su juicio, configuran el fraude que denunció. ""He tomado un tiempo prudente para poder comunicar de manera responsable varios hallazgos que considero realmente graves sobre los resultados electorales. Hechos que ponen en riesgo a nuestra democracia"", arranca el video de la candidata González. Luego de agradecer a sus votantes, la candidata Luisa González detalló al menos siete hallazgos que, a su criterio, configuran el fraude electoral que denunció la noche del 13 de abril de 2025 desde la sede de la Revolución Ciudadana, en Quito. Petro ofrece asilo a Aquiles Álvarez, Luisa González y otros 'opositores perseguidos' Le puede interesar: ¿Por qué Diego Borja intentó cruzar la frontera hacia Colombia luego del balotaje? Por ejemplo, denunció que hay múltiples versiones de actas que fueron modificadas desde el propio Consejo Nacional Electoral (CNE) una vez subidas al sistema. Según la candidata, eso ""alteró la cadena de custodia y el resultado final"". También sostuvo que hubo una disminución ""artificial"" del ausentismo , es decir, que hubo más votos que votantes. Además, que se registró una disminución del voto en blanco. Le puede interesar: Noboa sobre denuncia de fraude en las elecciones: ""Luisa González se quedó sola"" Por otro lado, González señaló que la mayoría de juntas receptoras del voto incumplieron el protocolo de inscribir el número de sufragantes. ""Exigimos al CNE la publicación de todas las actas debidamente firmadas y se realice una audiencia pública de auditoria al registro electoral"", acotó. La candidata correísta también destacó la existencia de 1.984 actas sin firma conjunta, 1.525 actas cuyas sumas no coinciden con el número de sufragantes y 1.582 actas cuyo resultado se desvía del promedio de su recinto electoral. "" (Hubo) posible ingresos adicionales de actas "", detalló. Al país, por la verdad, por la unidad, por la democracia, por la justicia de un pueblo que clama por días mejores. pic.twitter.com/Ybym8Pnj6P ¿Quieres acceder a todo el contenido de calidad sin límites? ¡SUSCRÍBETE AQUÍ! Las Últimas Noticias LO MÁS VISTO Ciencia y Tecnología Gira alrededor de su estrella y desprende una gran cantidad de minerales Guayaquil Un accidente en una construcción de Puerto Santa Ana dejó al menos tres trabajadores heridos este sábado 26 de abril Guayaquil El debate sobre cómo revivir el sentido comunitario en zonas porteñas toma fuerza. Expertos analizan la situación Mundo Taif produce cada año 300 millones de estas emblemáticas flores Mundo Tras la muerte del papa Francisco, el Vaticano sigue funcionando como un reloj Actualidad Tres elecciones presidenciales perdidas. Para expertos, el exmandatario debería dar un paso al costado, pero a qué costo Deportes Filtraciones apuntan a intereses económicos detrás de la titularidad del jugador juvenil que no destaca en su club Ocio El escritor español publicó ‘Canon de cámara oscura', obra que explora la escritura en medio del auge tecnológico Síguenos TODOS LOS DERECHOS RESERVADOS ©2025. QUEDA EXPRESAMENTE PROHIBIDO, TANTO DIRECTA COMO INDIRECTAMENTE, CEDER O TRANSMITIR A TERCEROS TODA O PARTE DE LA INFORMACIÓN AQUÍ PRESENTADA, SIN LA CORRESPONDIENTE LICENCIA O AUTORIZACIÓN POR PARTE DE GRÁFICOS NACIONALES S.A.",negativo,-0.3,3,0,Otros
Expreso,"Daniel Noboa sobre su reelección: ""Existe un voto duro noboísta de alrededor del 30%""",https://www.expreso.ec/actualidad/daniel-noboa-reeleccion-existe-voto-duro-noboista-alrededor-30-239164.html,"Daniel Noboa sobre su reelección: ""Existe un voto duro noboísta de alrededor del 30%""","Síguenos El presidente señaló que parte de su electorado no solo es anticorreísta, sino un ""voto correísta desilusionado"" El presidente Daniel Noboa analizó este 15 de abril de 2025 su reelección, alcanzada en la segunda vuelta electoral frente a la candidata correísta Luisa González , el domingo 13 de abril. Daniel Noboa sobre seguridad en Ecuador: “Que exista apoyo de fuerzas extranjeras” Le puede interesar: ¿El voto del adulto mayor fue realmente determinante para la victoria de Noboa? Según dijo Noboa en entrevista con CNN en Español, su victoria no sólo respondió a la adhesión de un voto anticorreísta que quedó cautivo tras la primera vuelta, sino a su propia votación. ""A mi me gusta basarme en la estadística, en la data real y en los estudios cualitativos que hacemos. Ya existe un voto noboísta de alrededor del 30% que están convencidos del proyecto (...)"", aseveró. Le puede interesar: Guayaquil, Quito y Cuenca: Así votaron las tres principales ciudades de Ecuador Noboa, además, sostuvo que el resto de la votación respondió a un "" voto correísta desilusionado "" que, según dijo, podría explicar su victoria en zonas dominadas por el correísmo. ""En Guayas, por ejemplo, que es la provincia más grande en población y tradicionalmente correísta, ganaban con 5 o 6 puntos de diferencia ; y ahora nosotros ganamos"", señaló. El presidente reelecto incluso señaló que la activación del voto facultativo de la tercera edad y jóvenes también fue clave para su victoria el 13 de abril de 2025. Por otro lado, respecto a la denuncia de Luisa González de un presunto fraude en la segunda vuelta electoral, Noboa señaló que es una actitud penosa por parte de la candidata correísta. ""Se quedó sola. Alcaldes, prefectos, autoridades electas, asambleístas de Revolución Ciudadana nos han concedido la victoria"", acotó y dijo que no hay nada que esperar. De hecho, adelantó que el reconteo solicitado por González ya se realizó en las zonas que exigía el correísmo. "" El resultado está claro, son más de 11 puntos. Ahí no hay discusión"", enfatizó. ¿Quieres acceder a todo el contenido de calidad sin límites? ¡SUSCRÍBETE AQUÍ! Las Últimas Noticias LO MÁS VISTO Ciencia y Tecnología Gira alrededor de su estrella y desprende una gran cantidad de minerales Guayaquil Un accidente en una construcción de Puerto Santa Ana dejó al menos tres trabajadores heridos este sábado 26 de abril Guayaquil El debate sobre cómo revivir el sentido comunitario en zonas porteñas toma fuerza. Expertos analizan la situación Mundo Taif produce cada año 300 millones de estas emblemáticas flores Mundo Tras la muerte del papa Francisco, el Vaticano sigue funcionando como un reloj Actualidad Tres elecciones presidenciales perdidas. Para expertos, el exmandatario debería dar un paso al costado, pero a qué costo Deportes Filtraciones apuntan a intereses económicos detrás de la titularidad del jugador juvenil que no destaca en su club Ocio El escritor español publicó ‘Canon de cámara oscura', obra que explora la escritura en medio del auge tecnológico Síguenos TODOS LOS DERECHOS RESERVADOS ©2025. QUEDA EXPRESAMENTE PROHIBIDO, TANTO DIRECTA COMO INDIRECTAMENTE, CEDER O TRANSMITIR A TERCEROS TODA O PARTE DE LA INFORMACIÓN AQUÍ PRESENTADA, SIN LA CORRESPONDIENTE LICENCIA O AUTORIZACIÓN POR PARTE DE GRÁFICOS NACIONALES S.A.",positivo,0.2,8,0,Seguridad
Expreso,Elecciones 2025: ¿De dónde vino el millón de votos más para Daniel Noboa?,https://www.expreso.ec/actualidad/elecciones-2025-vino-millon-votos-daniel-noboa-239153.html,Elecciones 2025: ¿De dónde vino el millón de votos más para Daniel Noboa?,"Síguenos El presidente reelecto cambió su suerte en cinco provincias. El voto volátil pudo incidir La distancia entre Daniel Noboa y Luisa González en las votaciones del 13 de abril es contundente. Hasta el cierre de esta nota, el Consejo Nacional Electoral (CNE) tenía escrutado el 99,35 % de las actas válidas y, con eso, lograba el 55,60 % frente al 44,4 % de González. Entonces, la pregunta es: ¿de donde salieron los 1,1 millones de votos de diferencia? (No te pierdas: Daniel Noboa aprueba condonación de deudas irrecuperables de hasta $ 5.000 en CFN ) El correísmo sufre su primera baja en la Asamblea a días de la primera sesión Las cifras muestran dos aspectos de ese crecimiento. El primero tiene que ver con la supuesta polarización , con regiones claramente señaladas en las que ganó cada uno en la primera vuelta. Eso no se reprodujo en la segunda vuelta . La votación dejó al presidente reelecto como ganador en 19 provincias del país. González, por su parte, logró la victoria solamente en cinco. Es decir, el apoyo de Noboa creció al punto de revertir el triunfo del correísmo en zonas que el segundo pensaba consolidadas. El otro aspecto tiene que ver precisamente con la ventaja en provincias perdidas en la primera vuelta. ADN gana en Guayas, Los Ríos, Santo Domingo, Imbabura y Orellana . Así, el mapa pintado del color del correísmo en la Costa durante la primera vuelta, cambió radicalmente. Pero también hay otras provincias en las que se registró un incremento en la votación para Noboa. En Cotopaxi , por ejemplo, ADN logra el 62,49 % de la votación , mientras que Luisa González el 37,5 %. Es decir, hubo una diferencia de 24 puntos entre ambos postulantes. En Azuay pasó algo similar. Entre la primera y la segunda vuelta, el presidente reelecto logró crecer poco más de 16 puntos, aunque ya había ganado en esa provincia. Además de estas dos provincias, Noboa aumentó su votación en otras como Bolívar, Chimborazo , Morona Santiago y Pichincha. Para el analista político Pedro Donoso , la respuesta a la pregunta sobre por qué ocurrió ese incremento requiere de un análisis más profundo y cualitativo. Sin ahondar en los aspectos, por ejemplo, sobre cómo votaron las personas en los cantones e incluso parroquias, toda explicación puede recaer en el terreno de la especulación . Sin embargo, en este punto se plantea una hipótesis respecto a lo ocurrido el pasado 13 de abril. Esta tiene que ver con que Noboa le quitó votos a González . Toma como referencia una de las encuestas previas a las elecciones hechas en Quito y Guayaquil a finales de marzo. “Hubo dos cifras fundamentales: una es sobre indecisos y la otra de la volatilidad del voto. Había 9 % de indecisión en Quito y 11,7 % en Guayaquil. Pero sobre la volatilidad en Quito, por ejemplo, existía un 7 % que decía: ‘Yo ya voté en la primera vuelta, pero estoy decidido a cambiar mi voto ’”. El analista recuerda que el nulo no varió y que el ausentismo se redujo mínimamente. “Es altamente probable que lo que haya sucedido es que Noboa le quite votos a González ”. Y esto no solo en las provincias donde revirtió el resultado, sino en el país en general. Pero desde la visión del manejo de las campañas, también existen elementos que pueden aportar alguna luz a lo acontecido. Para Wendy Reyes , docente de la George Washington University y directora de la consultora Proyelitica, pesó la condición de presidente-candidato durante la campaña. “En las provincias donde revierte resultados hubo una política de expansión del gasto social mediante bonos para poblaciones afectadas por el invierno. Podríamos decir que el presidente le ayudó al candidato”, sostiene Reyes. Guayaquil, Quito y Cuenca: Así votaron las tres principales ciudades de Ecuador Para la experta, el retroceso de González también se puede entender desde sus errores en la campaña. Los temas relacionados con la dolarización , la posición del correísmo frente al gobierno de Venezuela y la propuesta de los ‘gestores de paz’ pudieron incidir. “Para la población ecuatoriana, la dolarización representa estabilidad , y tratar de atentar contra esto no es bueno. Desde la Revolución Ciudadana hubo errores como el de la asambleísta Paola Cabezas en una entrevista”, señala Reyes. Por ahora, los resultados dejan a Noboa con una amplia distancia y con más provincias en las que cuenta con apoyo. Ayer estuvo en Carondelet, en su primer discurso allí tras las elecciones. Se dirigió a sus simpatizantes que se congregaron en la Plaza Grande de Quito. Insistió en su discurso en contra del correísmo, pero sin nombrarlo. “ El bien venció al mal ”, manifestó. ¿Quieres acceder a todo el contenido de calidad sin límites? ¡SUSCRÍBETE AQUÍ! Las Últimas Noticias LO MÁS VISTO Ciencia y Tecnología Gira alrededor de su estrella y desprende una gran cantidad de minerales Guayaquil Un accidente en una construcción de Puerto Santa Ana dejó al menos tres trabajadores heridos este sábado 26 de abril Guayaquil El debate sobre cómo revivir el sentido comunitario en zonas porteñas toma fuerza. Expertos analizan la situación Mundo Taif produce cada año 300 millones de estas emblemáticas flores Mundo Tras la muerte del papa Francisco, el Vaticano sigue funcionando como un reloj Actualidad Tres elecciones presidenciales perdidas. Para expertos, el exmandatario debería dar un paso al costado, pero a qué costo Deportes Filtraciones apuntan a intereses económicos detrás de la titularidad del jugador juvenil que no destaca en su club Ocio El escritor español publicó ‘Canon de cámara oscura', obra que explora la escritura en medio del auge tecnológico Síguenos TODOS LOS DERECHOS RESERVADOS ©2025. QUEDA EXPRESAMENTE PROHIBIDO, TANTO DIRECTA COMO INDIRECTAMENTE, CEDER O TRANSMITIR A TERCEROS TODA O PARTE DE LA INFORMACIÓN AQUÍ PRESENTADA, SIN LA CORRESPONDIENTE LICENCIA O AUTORIZACIÓN POR PARTE DE GRÁFICOS NACIONALES S.A.",neutro,0.02777777777777778,10,0,Otros
