Fuente,Titulo,URL,Titulo_Limpio,Contenido,Sentimiento_recalculado,Polaridad_recalculada,Menciones_Noboa,Menciones_Gonzalez,Temas
Expreso,¿Cuál es mi lugar de votación para la segunda vuelta electoral de Ecuador?,https://www.expreso.ec/actualidad/mi-lugar-votacion-segunda-vuelta-electoral-ecuador-revisalo-238643.html,¿Cuál es mi lugar de votación para la segunda vuelta electoral de Ecuador?,"Síguenos Ecuador se prepara para la segunda vuelta de elecciones, con más de 13 millones de ecuatorianos convocados a votar Con más de 13 millones de ecuatorianos convocados a las urnas este domingo 13 de abril, Ecuador vivirá un momento clave en su historia electoral . La segunda vuelta de las elecciones presidenciales promete ser un hito, con los candidatos Daniel Noboa, de Acción Democrática Nacional (ADN), y Luisa González, de Revolución Ciudadana , enfrentándose en una contienda que definirá al próximo presidente del país. El voto será obligatorio para todos los ciudadanos entre 18 y 65 años, mientras que los jóvenes de 16 y 17 años, los adultos mayores de 65, y las personas con discapacidad tendrán la opción de votar de manera facultativa. Para ejercer su derecho, los votantes deben presentar su cédula de identidad o pasaporte , incluso si estos documentos ya han caducado. CNE reubica algunos puntos de votación en Guayas: revisa si el tuyo está en la lista Te invitamos a leer | Semana Santa 2025 en Ecuador: ¿Cuántos días de descanso habrá según el Decreto 598? La jornada se llevará a cabo entre las 07:00 y las 17:00, y quienes vayan a votar deben asegurarse de consultar su recinto electoral , que será el mismo asignado durante la primera vuelta. En el exterior, los ecuatorianos también podrán sufragar a través de los consulados, cumpliendo con los mismos requisitos. Los últimos días de campaña, que terminaron el jueves 10 de abril con un cierre en Guayaquil, estuvieron marcados por el silencio electoral. Desde esa medianoche, los aspirantes a la Presidencia dejaron de hacer declaraciones públicas, permitiendo que la ciudadanía reflexionara sobre su voto. El padrón electoral refleja una división casi igual entre hombres y mujeres, con 6,7 millones de hombres (49,61%) y 7 millones de mujeres (50,39%) habilitados para votar. A ellos se suman más de 450.000 ecuatorianos que residen en el extranjero, quienes también están llamados a decidir el rumbo político del país. Aquellos que no acudan a las urnas sin una justificación deberán enfrentar una multa equivalente al 10% del salario básico unificado, unos 47 dólares . Esta sanción subraya la importancia de participar en un proceso democrático que, en esta ocasión, podría cambiar el rumbo de Ecuador. Para leer más contenido de EXPRESO, suscríbete aquí. Las Últimas Noticias LO MÁS VISTO Ciencia y Tecnología Gira alrededor de su estrella y desprende una gran cantidad de minerales Guayaquil Un accidente en una construcción de Puerto Santa Ana dejó al menos tres trabajadores heridos este sábado 26 de abril Guayaquil El debate sobre cómo revivir el sentido comunitario en zonas porteñas toma fuerza. Expertos analizan la situación Mundo Taif produce cada año 300 millones de estas emblemáticas flores Mundo Tras la muerte del papa Francisco, el Vaticano sigue funcionando como un reloj Actualidad Tres elecciones presidenciales perdidas. Para expertos, el exmandatario debería dar un paso al costado, pero a qué costo Deportes Filtraciones apuntan a intereses económicos detrás de la titularidad del jugador juvenil que no destaca en su club Ocio El escritor español publicó ‘Canon de cámara oscura', obra que explora la escritura en medio del auge tecnológico Síguenos TODOS LOS DERECHOS RESERVADOS ©2025. QUEDA EXPRESAMENTE PROHIBIDO, TANTO DIRECTA COMO INDIRECTAMENTE, CEDER O TRANSMITIR A TERCEROS TODA O PARTE DE LA INFORMACIÓN AQUÍ PRESENTADA, SIN LA CORRESPONDIENTE LICENCIA O AUTORIZACIÓN POR PARTE DE GRÁFICOS NACIONALES S.A.",neutro,0.0,2,0,Otros
Expreso,Segunda vuelta Ecuador: ¿Cómo estará el clima el día de las elecciones en Quito?,https://www.expreso.ec/quito/segunda-vuelta-ecuador-estara-clima-dia-elecciones-quito-238549.html,Segunda vuelta Ecuador: ¿Cómo estará el clima el día de las elecciones en Quito?,"Síguenos El 13 de abril de las elecciones, Quito tendrá un día nublado, fresco y con lluvias probables por la tarde. El 13 de abril de 2025 , Quito será un epicentro de la segunda vuelta de las elecciones presidenciales anticipadas, con miles de ciudadanos acudiendo a las urnas para elegir al próximo presidente. En una ciudad donde el clima puede pasar de soleado a lluvioso en minutos, saber cómo estará el tiempo es clave para los votantes. A dos días de la jornada, las tendencias climáticas dibujan un panorama para planificar el día electoral. Abril es el mes más húmedo en Quito, según el Instituto Nacional de Meteorología e Hidrología (INAMHI), y el 13 de abril no será la excepción. Basado en los boletines más recientes y patrones climáticos, se espera un día nublado con temperaturas entre 11 °C y 20 °C. Por la mañana , a las 07:00, cuando abran los recintos electorales, el clima será fresco , con unos 12 °C y cielo cubierto, pero sin lluvias significativas, ideal para salir a votar temprano. La humedad estará cerca del 75%, según Meteored, lo que hará sentir el frío más intenso. Desde el mediodía hasta las 16:00, la probabilidad de lluvias ligeras aumenta al 60%. ¿Quiénes están obligados a votar y quiénes no? Reglas para sufragar en Ecuador Con más de 1.5 millones de votantes esperados en Pichincha, según el Consejo Nacional Electoral (CNE), el clima podría complicar el acceso a los recintos de Quito. Las lluvias de esta semana, que causaron pequeños deslaves en el norte, han llevado al Municipio a reforzar la limpieza de alcantarillas en sectores como Carcelén y la avenida Simón Bolívar. Los votantes deberían llevar paraguas o impermeables para la tarde y usar ropa abrigada por la mañana fría. Las condiciones actuales apuntan a que el 13 de abril el clima será variable pero no debería detener la jornada. Por lo cual cada ciudadano debe prepararse para un día nublado con posibles lluvias y que puedan ejercer su derecho sin inconvenientes en la capital. Para más contenido de calidad SUSCRÍBETE A EXPRESO Las Últimas Noticias LO MÁS VISTO Ciencia y Tecnología Gira alrededor de su estrella y desprende una gran cantidad de minerales Guayaquil Un accidente en una construcción de Puerto Santa Ana dejó al menos tres trabajadores heridos este sábado 26 de abril Guayaquil El debate sobre cómo revivir el sentido comunitario en zonas porteñas toma fuerza. Expertos analizan la situación Mundo Taif produce cada año 300 millones de estas emblemáticas flores Mundo Tras la muerte del papa Francisco, el Vaticano sigue funcionando como un reloj Actualidad Tres elecciones presidenciales perdidas. Para expertos, el exmandatario debería dar un paso al costado, pero a qué costo Deportes Filtraciones apuntan a intereses económicos detrás de la titularidad del jugador juvenil que no destaca en su club Ocio El escritor español publicó ‘Canon de cámara oscura', obra que explora la escritura en medio del auge tecnológico Síguenos TODOS LOS DERECHOS RESERVADOS ©2025. QUEDA EXPRESAMENTE PROHIBIDO, TANTO DIRECTA COMO INDIRECTAMENTE, CEDER O TRANSMITIR A TERCEROS TODA O PARTE DE LA INFORMACIÓN AQUÍ PRESENTADA, SIN LA CORRESPONDIENTE LICENCIA O AUTORIZACIÓN POR PARTE DE GRÁFICOS NACIONALES S.A.",positivo,0.9,0,0,Otros
Expreso,Elecciones 2025: Noboa decreta limitación del ingreso de extranjeros al país,https://www.expreso.ec/actualidad/elecciones-2025-noboa-decreta-limitacion-ingreso-extranjeros-pais-238586.html,Elecciones 2025: Noboa decreta limitación del ingreso de extranjeros al país,"Síguenos El presidente Daniel Noboa emitió el Decreto Ejecutivo 597 con el que se plantean restricciones en las zonas de frontera Dos días antes de las elecciones presidenciales , el Gobierno de Daniel Noboa restringe el paso de extranjeros por las fronteras. Este 11 de abril de 2025 se emitió el Decreto Ejecutivo 597 , mediante el cual se establecen medidas excepcionales para garantizar la seguridad durante la segunda vuelta electoral. (No te pierdas: ¿Puedo llevar mi celular a votar? Esto dice el CNE sobre el uso de dispositivos ) Elecciones Ecuador: las tres grandes mentiras que fueron parte de la campaña Como medida principal, el decreto dispone una regulación especial temporal en las zonas de seguridad de las fronteras norte y sur del país. Desde las 16:00 del viernes 11 de abril hasta las 23:59 del lunes 14 de abril, se limitará el ingreso al territorio nacional de personas extranjeras . Según el Ejecutivo, esta decisión busca prevenir cualquier acción que pueda comprometer la seguridad interna durante el proceso electoral. El decreto también ordena la continuación del despliegue operacional y táctico de las Fuerzas Armadas en los principales puertos de la Costa ecuatoriana: Guayaquil, Puerto Bolívar, Manta y Esmeraldas. Además se intensificará el control en las facilidades pesqueras artesanales y puertos pesqueros artesanales, con el objetivo de garantizar el normal funcionamiento de estos sectores estratégicos. A la ciudadanía: pic.twitter.com/hT4nZTEc7z La jornada de votaciones se desarrollará desde las 07:00 del próximo domingo 13 de abril en todo el país y en las circunscripciones del exterior . Los ecuatorianos votarán para elegir al próximo presidente o presidenta del Ecuador. La contienda electoral ha estado marcada por la confrontación entre los candidatos Daniel Noboa (ADN) y Luisa González (Revolución Ciudadana). Los comicios del domingo, que terminarán a las 17:00, definirán al nuevo gobierno por los próximos cuatro años. ¿Quieres acceder a todo el contenido de calidad sin límites? ¡SUSCRÍBETE AQUÍ! Las Últimas Noticias LO MÁS VISTO Ciencia y Tecnología Gira alrededor de su estrella y desprende una gran cantidad de minerales Guayaquil Un accidente en una construcción de Puerto Santa Ana dejó al menos tres trabajadores heridos este sábado 26 de abril Guayaquil El debate sobre cómo revivir el sentido comunitario en zonas porteñas toma fuerza. Expertos analizan la situación Mundo Taif produce cada año 300 millones de estas emblemáticas flores Mundo Tras la muerte del papa Francisco, el Vaticano sigue funcionando como un reloj Actualidad Tres elecciones presidenciales perdidas. Para expertos, el exmandatario debería dar un paso al costado, pero a qué costo Deportes Filtraciones apuntan a intereses económicos detrás de la titularidad del jugador juvenil que no destaca en su club Ocio El escritor español publicó ‘Canon de cámara oscura', obra que explora la escritura en medio del auge tecnológico Síguenos TODOS LOS DERECHOS RESERVADOS ©2025. QUEDA EXPRESAMENTE PROHIBIDO, TANTO DIRECTA COMO INDIRECTAMENTE, CEDER O TRANSMITIR A TERCEROS TODA O PARTE DE LA INFORMACIÓN AQUÍ PRESENTADA, SIN LA CORRESPONDIENTE LICENCIA O AUTORIZACIÓN POR PARTE DE GRÁFICOS NACIONALES S.A.",positivo,0.15,6,0,Seguridad
Expreso,¿Dónde me toca votar en la segunda vuelta? Consulta el lugar de votación aquí,https://www.expreso.ec/actualidad/politica/me-toca-votar-segunda-vuelta-consulta-lugar-votacion-234144.html,¿Dónde me toca votar en la segunda vuelta? Consulta el lugar de votación aquí,"Síguenos Más de 13,7 millones de ecuatorianos están convocados a retornar a las urnas el 13 de abril de 2025. Las elecciones presidenciales en Ecuador se definirán en un balotaje el domingo 13 de abril de 2025. Ante esta nueva jornada electoral, muchos ciudadanos se preguntan si existen cambios en el lugar de votación que fueron asignados para sufragar en la primera vuelta del 9 de febrero. Elecciones Ecuador 2025: Todo lo que necesitas saber antes de la segunda vuelta El Consejo Nacional Electoral ( CNE ) no ha estipulado cambios en el padrón electoral, por lo que lo que si eres uno de los ecuatorianos que aún tiene dudas sobre el lugar donde ejercerá su derecho al voto en la segunda vuelta, debes saber que se trata del mismo recinto electoral al que fuiste asignado en primera vuelta. Si has olvidado tu lugar de votación, el CNE ha habilitado en su página web la sección Consulta tu lugar de votación . Solo necesitarás tu número de cédula para obtener la información exacta de la mesa en la que te corresponde votar. Para conocer tu lugar de votación, ingresa tus datos en el apartado de abajo. Aquí debes colocar el número de cédula para obtener los datos del recinto donde deberás presentarte el 13 de abril. Esta herramienta también permitirá a los votantes confirmar si deben cumplir con funciones en las juntas receptoras del voto , en caso de haber sido designados. Consultar el lugar de votación es una parte fundamental del proceso electoral. Asegúrate de realizarlo con tiempo, para que puedas ejercer tu derecho al voto de manera ordenada y sin contratiempos el próximo 13 de abril. Para seguir leyendo EXPRESO sin límites, SUSCRÍBETE AQUÍ. Las Últimas Noticias LO MÁS VISTO Ciencia y Tecnología Gira alrededor de su estrella y desprende una gran cantidad de minerales Guayaquil Un accidente en una construcción de Puerto Santa Ana dejó al menos tres trabajadores heridos este sábado 26 de abril Guayaquil El debate sobre cómo revivir el sentido comunitario en zonas porteñas toma fuerza. Expertos analizan la situación Mundo Taif produce cada año 300 millones de estas emblemáticas flores Mundo Tras la muerte del papa Francisco, el Vaticano sigue funcionando como un reloj Actualidad Tres elecciones presidenciales perdidas. Para expertos, el exmandatario debería dar un paso al costado, pero a qué costo Deportes Filtraciones apuntan a intereses económicos detrás de la titularidad del jugador juvenil que no destaca en su club Ocio El escritor español publicó ‘Canon de cámara oscura', obra que explora la escritura en medio del auge tecnológico Síguenos TODOS LOS DERECHOS RESERVADOS ©2025. QUEDA EXPRESAMENTE PROHIBIDO, TANTO DIRECTA COMO INDIRECTAMENTE, CEDER O TRANSMITIR A TERCEROS TODA O PARTE DE LA INFORMACIÓN AQUÍ PRESENTADA, SIN LA CORRESPONDIENTE LICENCIA O AUTORIZACIÓN POR PARTE DE GRÁFICOS NACIONALES S.A.",neutro,0.0,0,0,Renovación Política
Expreso,Daniel Noboa ofrece becas académicas para 25.000 mujeres: ¿Cómo acceder?,https://www.expreso.ec/actualidad/daniel-noboa-ofrece-becas-academicas-25-000-mujeres-acceder-180796.html,Daniel Noboa ofrece becas académicas para 25.000 mujeres: ¿Cómo acceder?,"Síguenos El primer mandatario realizó el anuncio el 25N, fecha en la que se conmemora el día Internacional de la Eliminación de la Violencia contra la Mujer Una ventana para 25 mil mujeres. El presidente de Ecuador, Daniel Noboa Azín, dio detalles sobre la gran noticia el pasado 25 de noviembre, fecha en la que, a nivel internacional, se celebró, el día Internacional de la Eliminación de la Violencia contra la Mujer. ""Nos complace informarles que iniciaremos un programa que otorgará 25.000 becas a mujeres para su preparación académica superior”, escribió Noboa en sus redes sociales. Noboa envía a la Asamblea su reforma tributaria que busca $ 832 millones para 2024 ¿Cómo acceder a las becas? Las personas interesadas en acceder a una de las 25.000 becas que ofrece el Gobierno Nacional deben ingresar a la página www.noboa.ec y llenar un formulario con sus datos personales, como número de cédula, nombres, lugar de residencia y carrera en la que quisiera especializarse. Entre las opciones que ofrece el programa Capacítate, del presidente Daniel Noboa , hay especializaciones como marketing y ventas, administración, abogacía, entre otras. Pero también hay opciones a corto plazo, como pescador, vendedor, emprendedor, operador de maquinaria pesada, cocinero, panadería, mesero, ingeniería civil, ingeniería eléctrica, medicina veterinaria, idiomas y computación e informática. Lee también: ""Hay llamadas de prestadores externos para agendar citas sobre ellos mismos"" El primer mandatario precisó que ""las primeras personas consideradas para este beneficio serán aquellas que se registraron en la página web Capacítate y las nuevas inscripciones"". Es decir, aquellos usuarios que, previo o antes de este anuncio, se registraron en la pagina web en busca de algún programa de capacitación continua o formación. Una publicación compartida de Daniel Noboa Azin (@danielnoboaok) El anuncio sobre la habilitación de las 25 mil becas fue realizado directamente por Noboa, en su cuenta de Instagram, sin embargo, no detalló la fecha en que se publicaría la lista de ganadores y las entidades educativas nacionales que estarían participando. ¿Quieres acceder a todo el contenido de calidad sin límites? ¡SUSCRÍBETE AQUÍ! Las Últimas Noticias LO MÁS VISTO Ciencia y Tecnología Gira alrededor de su estrella y desprende una gran cantidad de minerales Guayaquil Un accidente en una construcción de Puerto Santa Ana dejó al menos tres trabajadores heridos este sábado 26 de abril Guayaquil El debate sobre cómo revivir el sentido comunitario en zonas porteñas toma fuerza. Expertos analizan la situación Mundo Taif produce cada año 300 millones de estas emblemáticas flores Mundo Tras la muerte del papa Francisco, el Vaticano sigue funcionando como un reloj Actualidad Tres elecciones presidenciales perdidas. Para expertos, el exmandatario debería dar un paso al costado, pero a qué costo Deportes Filtraciones apuntan a intereses económicos detrás de la titularidad del jugador juvenil que no destaca en su club Ocio El escritor español publicó ‘Canon de cámara oscura', obra que explora la escritura en medio del auge tecnológico Síguenos TODOS LOS DERECHOS RESERVADOS ©2025. QUEDA EXPRESAMENTE PROHIBIDO, TANTO DIRECTA COMO INDIRECTAMENTE, CEDER O TRANSMITIR A TERCEROS TODA O PARTE DE LA INFORMACIÓN AQUÍ PRESENTADA, SIN LA CORRESPONDIENTE LICENCIA O AUTORIZACIÓN POR PARTE DE GRÁFICOS NACIONALES S.A.",positivo,0.7,11,0,Seguridad
El Extra,Daniel Noboa: Fuerzas Armadas alertan posible plan para atentar contra mandatario,https://www.extra.ec/noticia/actualidad/daniel-noboa-fuerzas-armadas-alertan-posible-plan-atentar-mandatario-126337.html,Daniel Noboa: Fuerzas Armadas alertan posible plan para atentar contra mandatario,"Síguenos La vida del presidente de Ecuador, Daniel Noboa, así como la de su gabinete y colaboradores cercanos, estaría en riesgo , según un informe de inteligencia elaborado por el Comando Conjunto de las Fuerzas Armadas, al que accedió este Diario y cuya autenticidad fue confirmada por el Gobierno. (Lee además: Masacre en Manabí: aumentan las víctimas, detenidos y un armamento que alarma ) El documento, con fecha del 17 de abril de 2025, advierte que luego de la segunda vuelta electoral celebrada el domingo 13 de abril, se habría iniciado el ingreso de sicarios provenientes de México y otros países con el objetivo de perpetrar atentados terroristas dirigidos contra el mandatario, su equipo ministerial y sus colaboradores. Además, el informe militar advierte sobre la posible organización de atentados en infraestructuras clave del país, como puentes principales, entidades bancarias y otras instituciones del Estado. El texto reservado también menciona que estas acciones formarían parte de un plan más amplio para generar disturbios mediante protestas que podrían derivar en hechos violentos, aunque no se ofrecen mayores detalles sobre las posibles movilizaciones. ¿Quieres acceder a todo el contenido de calidad sin límites? ¡Suscríbete aquí! Últimas noticias Más leídas Actualidad Un accidente en una construcción de Puerto Santa Ana dejó al menos tres trabajadores heridos este sábado 26 de abril Actualidad El cabecilla de la organización criminal Los Tiguerones es requerido en Ecuador por la toma de TC Televisión en 2024. Él fue detenido en España Deportes Barcelona gana 1-0 a Macará en Ambato y se alista para celebrar su Centenario Deportes Filtraciones apuntan a intereses económicos detrás de la titularidad del juvenil que ni siquiera destaca en su club Todos los derechos reservados ©2024. Queda expresamente prohibido, tanto directa como indirectamente, ceder o transmitir a terceros toda o parte de la información aquí presentada, sin la correspondiente licencia o autorización por parte de Gráﬁcos Nacionales S.A.",negativo,-0.4,2,0,Otros
